{
  "schema_version": "1.1.0",
  "system": {
    "id": "development-assurance-system",
    "version": "1.5.0",
    "source": "C:\\Users\\ville\\saturnine-spheres\\general-prompts",
    "source_revision": "unknown:local-distribution-no-immutable-revision",
    "distribution_digest": "sha256:e3ff9857b57e372f314ff365d8d40a0d667c366228c9ce4208ea553a3dd94f1f"
  },
  "installation": {
    "mode": "existing",
    "selected_preset": "lightweight",
    "installed_at": "2026-10-24T09:55:45.774970+00:00",
    "installed_by": "tools/scaffold_project.py; owner approval not implied",
    "repository": "C:\\Users\\ville\\AppData\\Local\\Temp\\claude\\C--Users-ville-saturnine-spheres-general-prompts\\a095f710-881f-469d-ba6f-c95cb3f958d4\\scratchpad\\sb\\repo",
    "baseline_revision": "d7cd67cbe5bdd3cabeafef841e49587b1b32ee82",
    "status": "draft",
    "footprint": "minimal",
    "legacy": false,
    "adapters": [
      "claude-code",
      "github"
    ]
  },
  "managed_artifacts": [
    {
      "path": "AGENTS.md",
      "upstream_path": "AGENTS.template.md",
      "upstream_digest": "sha256:0896cbde29591b830ffec5af4b5eea92f837b5c72d1629fb2015260c675bc034",
      "installed_digest": "sha256:0896cbde29591b830ffec5af4b5eea92f837b5c72d1629fb2015260c675bc034",
      "ownership": "merge-managed",
      "local_changes": false
    },
    {
      "path": ".assurance/README.md",
      "upstream_path": "assurance-directory-readme.template.md",
      "upstream_digest": "sha256:4a6e74058a5fff23b26e088fc52417f93bed6447ec5c35433a1237b71bf88cad",
      "installed_digest": "sha256:4a6e74058a5fff23b26e088fc52417f93bed6447ec5c35433a1237b71bf88cad",
      "ownership": "merge-managed",
      "local_changes": false
    },
    {
      "path": ".assurance/project-assurance-profile.json",
      "upstream_path": "project-assurance-profile.template.json",
      "upstream_digest": "sha256:fdb65fd99d90923306dca426db78daefe10d7224bbf47b45b6eb5cd553e4aeb8",
      "installed_digest": "sha256:2bb810fcbdd9eeb6b4a2d56c86889b99d0a4699ebbfc0b3377a7c8a01ed9bfdc",
      "ownership": "project-owned",
      "local_changes": true
    },
    {
      "path": ".assurance/process.json",
      "upstream_path": "process-contract.template.json",
      "upstream_digest": "sha256:4e1ebdc4dfb67596e7b8ca60e62c7adf0820df161f525224b8866c7e5c7b6f59",
      "installed_digest": "sha256:4e1ebdc4dfb67596e7b8ca60e62c7adf0820df161f525224b8866c7e5c7b6f59",
      "ownership": "project-owned",
      "local_changes": false
    },
    {
      "path": ".assurance/control-catalog.yaml",
      "upstream_path": "control-catalog.template.yaml",
      "upstream_digest": "sha256:db5dca08fc879796558d957bea207b0a66e16be4386cb9dafed1c68a35dccfa7",
      "installed_digest": "sha256:db5dca08fc879796558d957bea207b0a66e16be4386cb9dafed1c68a35dccfa7",
      "ownership": "merge-managed",
      "local_changes": false
    },
    {
      "path": ".assurance/change-class-evidence-matrix.json",
      "upstream_path": "change-class-evidence-matrix.json",
      "upstream_digest": "sha256:7bc66810900dca9246095aeec8cd60902f5784ab078ca992abef610dd74f47af",
      "installed_digest": "sha256:7bc66810900dca9246095aeec8cd60902f5784ab078ca992abef610dd74f47af",
      "ownership": "merge-managed",
      "local_changes": false
    },
    {
      "path": ".assurance/generalized-development-assurance-guidelines.md",
      "upstream_path": "generalized-development-assurance-guidelines.md",
      "upstream_digest": "sha256:594a1a0573478dc67246b0f1501175703e12eceadb02db6daaf64bb6e69ccb3f",
      "installed_digest": "sha256:594a1a0573478dc67246b0f1501175703e12eceadb02db6daaf64bb6e69ccb3f",
      "ownership": "merge-managed",
      "local_changes": false
    },
    {
      "path": ".assurance/tiered-verifier-contract.md",
      "upstream_path": "tiered-verifier-contract.md",
      "upstream_digest": "sha256:ee12ce58c901646fcb455fbd49d2db5f25dc789e9b0301872ac47a506a70ca73",
      "installed_digest": "sha256:ee12ce58c901646fcb455fbd49d2db5f25dc789e9b0301872ac47a506a70ca73",
      "ownership": "merge-managed",
      "local_changes": false
    },
    {
      "path": ".assurance/glossary.md",
      "upstream_path": "glossary.md",
      "upstream_digest": "sha256:a7d0ef687344ecd4f33c2c19b3a9ab09bc934c030810aaa0a17e42e71a38504c",
      "installed_digest": "sha256:a7d0ef687344ecd4f33c2c19b3a9ab09bc934c030810aaa0a17e42e71a38504c",
      "ownership": "merge-managed",
      "local_changes": false
    },
    {
      "path": ".assurance/installation-and-update-guide.md",
      "upstream_path": "installation-and-update-guide.md",
      "upstream_digest": "sha256:425ff8fb4955bf9255baa922377aa935ede9e09f068747dfe62b4ae86a4cbbf4",
      "installed_digest": "sha256:425ff8fb4955bf9255baa922377aa935ede9e09f068747dfe62b4ae86a4cbbf4",
      "ownership": "merge-managed",
      "local_changes": false
    },
    {
      "path": ".assurance/schemas/project-assurance-profile.schema.json",
      "upstream_path": "schemas/project-assurance-profile.schema.json",
      "upstream_digest": "sha256:692942e24affc13e6841da78abeb4df85a300b9376b046b14f8221c7a25409f5",
      "installed_digest": "sha256:692942e24affc13e6841da78abeb4df85a300b9376b046b14f8221c7a25409f5",
      "ownership": "upstream-managed",
      "local_changes": false
    },
    {
      "path": ".assurance/schemas/control-catalog.schema.json",
      "upstream_path": "schemas/control-catalog.schema.json",
      "upstream_digest": "sha256:6944198a931ecd59b5db189f9865168e7c8ac1262e9b4c7bf9c9bff4f2bcc7d9",
      "installed_digest": "sha256:6944198a931ecd59b5db189f9865168e7c8ac1262e9b4c7bf9c9bff4f2bcc7d9",
      "ownership": "upstream-managed",
      "local_changes": false
    },
    {
      "path": ".assurance/schemas/change-class-evidence-matrix.schema.json",
      "upstream_path": "schemas/change-class-evidence-matrix.schema.json",
      "upstream_digest": "sha256:bd4df114209eba93cc752d53bb3b0a526cbc5fb64e6da85ce480ec045c3714ed",
      "installed_digest": "sha256:bd4df114209eba93cc752d53bb3b0a526cbc5fb64e6da85ce480ec045c3714ed",
      "ownership": "upstream-managed",
      "local_changes": false
    },
    {
      "path": ".assurance/schemas/review-record.schema.json",
      "upstream_path": "schemas/review-record.schema.json",
      "upstream_digest": "sha256:d8e1b2ca3ac2dceb310a01a82cc57b46874ca42ad51ac0adc827099170e9f73f",
      "installed_digest": "sha256:d8e1b2ca3ac2dceb310a01a82cc57b46874ca42ad51ac0adc827099170e9f73f",
      "ownership": "upstream-managed",
      "local_changes": false
    },
    {
      "path": ".assurance/schemas/verification-result.schema.json",
      "upstream_path": "schemas/verification-result.schema.json",
      "upstream_digest": "sha256:a7ed21f4d9b3950313d9c2aad81effa848903ec0d5ae31fb4cc0eeab5e6a69f8",
      "installed_digest": "sha256:a7ed21f4d9b3950313d9c2aad81effa848903ec0d5ae31fb4cc0eeab5e6a69f8",
      "ownership": "upstream-managed",
      "local_changes": false
    },
    {
      "path": ".assurance/schemas/waiver.schema.json",
      "upstream_path": "schemas/waiver.schema.json",
      "upstream_digest": "sha256:121779bee2d9b368171077025bbdfb65a0a31686e3d1c6bb2b17709809be2935",
      "installed_digest": "sha256:121779bee2d9b368171077025bbdfb65a0a31686e3d1c6bb2b17709809be2935",
      "ownership": "upstream-managed",
      "local_changes": false
    },
    {
      "path": ".assurance/schemas/agent-effect-manifest.schema.json",
      "upstream_path": "schemas/agent-effect-manifest.schema.json",
      "upstream_digest": "sha256:cc926ac2909f1fb465b6dd37c27410311f2a5e6ec7e4a333c965359231097422",
      "installed_digest": "sha256:cc926ac2909f1fb465b6dd37c27410311f2a5e6ec7e4a333c965359231097422",
      "ownership": "upstream-managed",
      "local_changes": false
    },
    {
      "path": ".assurance/schemas/assurance-system-manifest.schema.json",
      "upstream_path": "schemas/assurance-system-manifest.schema.json",
      "upstream_digest": "sha256:ca933c7ca352005bc8427495b03e59c870aed207de7ef652eda7eb043561223e",
      "installed_digest": "sha256:ca933c7ca352005bc8427495b03e59c870aed207de7ef652eda7eb043561223e",
      "ownership": "upstream-managed",
      "local_changes": false
    },
    {
      "path": ".assurance/schemas/run-manifest.schema.json",
      "upstream_path": "schemas/run-manifest.schema.json",
      "upstream_digest": "sha256:7fdff092aa4e9a4c005acd44ad220b3837bd56ddb2aa5c9e57d5d42be7f77f5d",
      "installed_digest": "sha256:7fdff092aa4e9a4c005acd44ad220b3837bd56ddb2aa5c9e57d5d42be7f77f5d",
      "ownership": "upstream-managed",
      "local_changes": false
    },
    {
      "path": ".assurance/schemas/process-contract.schema.json",
      "upstream_path": "schemas/process-contract.schema.json",
      "upstream_digest": "sha256:d35dfa322dab35e6ad9fab5e1518cdca9c580abfc0a4d57aee2eb2218a0f20b7",
      "installed_digest": "sha256:d35dfa322dab35e6ad9fab5e1518cdca9c580abfc0a4d57aee2eb2218a0f20b7",
      "ownership": "upstream-managed",
      "local_changes": false
    },
    {
      "path": ".assurance/schemas/verifier-config.schema.json",
      "upstream_path": "schemas/verifier-config.schema.json",
      "upstream_digest": "sha256:3b8d0fb67619bf8279753bf8ba84e0192c941202de17c88c59698cbbbefa6408",
      "installed_digest": "sha256:3b8d0fb67619bf8279753bf8ba84e0192c941202de17c88c59698cbbbefa6408",
      "ownership": "upstream-managed",
      "local_changes": false
    },
    {
      "path": ".assurance/schemas/migration-record.schema.json",
      "upstream_path": "schemas/migration-record.schema.json",
      "upstream_digest": "sha256:e1c702f540da7cd0271906b7dfe842a249ff5dfde44d07894ac0f97cf42709cf",
      "installed_digest": "sha256:e1c702f540da7cd0271906b7dfe842a249ff5dfde44d07894ac0f97cf42709cf",
      "ownership": "upstream-managed",